[
  {
    "capacity_per_year": 32857.72,
    "capacity_unit": "t_per_year",
    "capex_usd": 218076626.59,
    "company": "Compañía Andina (ilustrativa)",
    "geo": "AR-R",
    "id": "mock-proj-0",
    "name": "Bloque Meseta 1",
    "owners": [
      "Compañía Andina (ilustrativa)",
      "Socio 1 (ilustrativo)"
    ],
    "resource": "oil",
    "retrieved_at": "2026-10-02",
    "source": "MOCK",
    "start_year": 2031,
    "status": "announced"
  },
  {
    "capacity_per_year": 5502.69,
    "capacity_unit": "t_per_year",
    "capex_usd": 577280648.31,
    "company": "Minera Austral (ilustrativa)",
    "geo": "AR-R",
    "id": "mock-proj-1",
    "name": "Área Cuenca Sur 1",
    "owners": [
      "Minera Austral (ilustrativa)",
      "Socio 2 (ilustrativo)"
    ],
    "resource": "oil",
    "retrieved_at": "2026-10-02",
    "source": "MOCK",
    "start_year": 2025,
    "status": "prefeasibility"
  },
  {
    "capacity_per_year": 32461.5,
    "capacity_unit": "t_per_year",
    "capex_usd": 455177814.73,
    "company": "Energía del Sur (ilustrativa)",
    "geo": "AR-A",
    "id": "mock-proj-2",
    "name": "Planta Cordillera 1",
    "owners": [
      "Energía del Sur (ilustrativa)",
      "Socio 3 (ilustrativo)"
    ],
    "resource": "gas",
    "retrieved_at": "2026-10-02",
    "source": "MOCK",
    "start_year": 2035,
    "status": "prefeasibility"
  },
  {
    "capacity_per_year": null,
    "capacity_unit": null,
    "capex_usd": 721868651.08,
    "company": "Recursos Patagonia (ilustrativa)",
    "geo": "AR-J",
    "id": "mock-proj-3",
    "name": "Cordón Rojo 1",
    "note": "Capacidad faltante (mock ilustrativo)",
    "owners": [
      "Recursos Patagonia (ilustrativa)",
      "Socio 4 (ilustrativo)"
    ],
    "resource": "copper",
    "retrieved_at": "2026-10-02",
    "source": "MOCK",
    "start_year": 2034,
    "status": "announced"
  },
  {
    "capacity_per_year": 23353.74,
    "capacity_unit": "t_per_year",
    "capex_usd": 607148866.47,
    "company": "Grupo Cordillera (ilustrativa)",
    "geo": "AR-A",
    "id": "mock-proj-4",
    "name": "Campo del Valle 2",
    "owners": [
      "Grupo Cordillera (ilustrativa)",
      "Socio 1 (ilustrativo)"
    ],
    "resource": "gas",
    "retrieved_at": "2026-10-02",
    "source": "MOCK",
    "start_year": 2031,
    "status": "feasibility"
  },
  {
    "capacity_per_year": null,
    "capacity_unit": null,
    "capex_usd": null,
    "company": "Explotaciones del Norte (ilustrativa)",
    "geo": "AR-Z",
    "id": "mock-proj-5",
    "name": "Cerro Brillante 2",
    "note": "Capacidad faltante (mock ilustrativo); capex faltante (mock ilustrativo)",
    "owners": [
      "Explotaciones del Norte (ilustrativa)",
      "Socio 2 (ilustrativo)"
    ],
    "resource": "gold",
    "retrieved_at": "2026-10-02",
    "source": "MOCK",
    "start_year": 2025,
    "status": "construction"
  },
  {
    "capacity_per_year": 29753.13,
    "capacity_unit": "t_per_year",
    "capex_usd": 846165830.72,
    "company": "Compañía Andina (ilustrativa)",
    "geo": "AR-A",
    "id": "mock-proj-6",
    "name": "Planta Cordillera 2",
    "owners": [
      "Compañía Andina (ilustrativa)",
      "Socio 3 (ilustrativo)"
    ],
    "resource": "gas",
    "retrieved_at": "2026-10-02",
    "source": "MOCK",
    "start_year": 2020,
    "status": "exploration"
  },
  {
    "capacity_per_year": 45757.76,
    "capacity_unit": "t_per_year",
    "capex_usd": 167582592.26,
    "company": "Minera Austral (ilustrativa)",
    "geo": "AR-M",
    "id": "mock-proj-7",
    "name": "Formación Profunda 2",
    "owners": [
      "Minera Austral (ilustrativa)",
      "Socio 4 (ilustrativo)"
    ],
    "resource": "oil",
    "retrieved_at": "2026-10-02",
    "source": "MOCK",
    "start_year": 2035,
    "status": "exploration"
  },
  {
    "capacity_per_year": null,
    "capacity_unit": null,
    "capex_usd": 10427803.42,
    "company": "Energía del Sur (ilustrativa)",
    "geo": "AR-K",
    "id": "mock-proj-8",
    "name": "Cerro Alto 3",
    "note": "Capacidad faltante (mock ilustrativo)",
    "owners": [
      "Energía del Sur (ilustrativa)",
      "Socio 1 (ilustrativo)"
    ],
    "resource": "copper",
    "retrieved_at": "2026-10-02",
    "source": "MOCK",
    "start_year": 2020,
    "status": "feasibility"
  },
  {
    "capacity_per_year": null,
    "capacity_unit": null,
    "capex_usd": 148675440.84,
    "company": "Recursos Patagonia (ilustrativa)",
    "geo": "AR-A",
    "id": "mock-proj-9",
    "name": "Mina del Oeste 3",
    "note": "Capacidad faltante (mock ilustrativo)",
    "owners": [
      "Recursos Patagonia (ilustrativa)",
      "Socio 2 (ilustrativo)"
    ],
    "resource": "copper",
    "retrieved_at": "2026-10-02",
    "source": "MOCK",
    "start_year": 2030,
    "status": "operating"
  },
  {
    "capacity_per_year": null,
    "capacity_unit": null,
    "capex_usd": 862621217.59,
    "company": "Grupo Cordillera (ilustrativa)",
    "geo": "AR-A",
    "id": "mock-proj-10",
    "name": "Salar del Norte 3",
    "note": "Capacidad faltante (mock ilustrativo)",
    "owners": [
      "Grupo Cordillera (ilustrativa)",
      "Socio 3 (ilustrativo)"
    ],
    "resource": "lithium",
    "retrieved_at": "2026-10-02",
    "source": "MOCK",
    "start_year": 2034,
    "status": "construction"
  },
  {
    "capacity_per_year": null,
    "capacity_unit": null,
    "capex_usd": 610826501.12,
    "company": "Explotaciones del Norte (ilustrativa)",
    "geo": "AR-A",
    "id": "mock-proj-11",
    "name": "Gasoducto Sur 3",
    "note": "Capacidad faltante (mock ilustrativo)",
    "owners": [
      "Explotaciones del Norte (ilustrativa)",
      "Socio 4 (ilustrativo)"
    ],
    "resource": "gas",
    "retrieved_at": "2026-10-02",
    "source": "MOCK",
    "start_year": 2035,
    "status": "ramp_up"
  },
  {
    "capacity_per_year": 39986.77,
    "capacity_unit": "t_per_year",
    "capex_usd": 807639772.79,
    "company": "Compañía Andina (ilustrativa)",
    "geo": "AR-R",
    "id": "mock-proj-12",
    "name": "Bloque Meseta 4",
    "owners": [
      "Compañía Andina (ilustrativa)",
      "Socio 1 (ilustrativo)"
    ],
    "resource": "oil",
    "retrieved_at": "2026-10-02",
    "source": "MOCK",
    "start_year": 2028,
    "status": "approved"
  },
  {
    "capacity_per_year": 32338.14,
    "capacity_unit": "t_per_year",
    "capex_usd": 113713967.92,
    "company": "Minera Austral (ilustrativa)",
    "geo": "AR-Z",
    "id": "mock-proj-13",
    "name": "Área Cuenca Sur 4",
    "owners": [
      "Minera Austral (ilustrativa)",
      "Socio 2 (ilustrativo)"
    ],
    "resource": "oil",
    "retrieved_at": "2026-10-02",
    "source": "MOCK",
    "start_year": 2029,
    "status": "announced"
  },
  {
    "capacity_per_year": 22534.82,
    "capacity_unit": "t_per_year",
    "capex_usd": null,
    "company": "Energía del Sur (ilustrativa)",
    "geo": "AR-Y",
    "id": "mock-proj-14",
    "name": "Cuenca Austral 3",
    "note": "Capex faltante (mock ilustrativo)",
    "owners": [
      "Energía del Sur (ilustrativa)",
      "Socio 3 (ilustrativo)"
    ],
    "resource": "lithium",
    "retrieved_at": "2026-10-02",
    "source": "MOCK",
    "start_year": 2029,
    "status": "operating"
  },
  {
    "capacity_per_year": null,
    "capacity_unit": null,
    "capex_usd": 372722765.73,
    "company": "Recursos Patagonia (ilustrativa)",
    "geo": "AR-K",
    "id": "mock-proj-15",
    "name": "Salar del Norte 4",
    "note": "Capacidad faltante (mock ilustrativo)",
    "owners": [
      "Recursos Patagonia (ilustrativa)",
      "Socio 4 (ilustrativo)"
    ],
    "resource": "lithium",
    "retrieved_at": "2026-10-02",
    "source": "MOCK",
    "start_year": 2023,
    "status": "exploration"
  },
  {
    "capacity_per_year": 46148.15,
    "capacity_unit": "t_per_year",
    "capex_usd": null,
    "company": "Grupo Cordillera (ilustrativa)",
    "geo": "AR-A",
    "id": "mock-proj-16",
    "name": "Cerro Alto 5",
    "note": "Capex faltante (mock ilustrativo)",
    "owners": [
      "Grupo Cordillera (ilustrativa)",
      "Socio 1 (ilustrativo)"
    ],
    "resource": "copper",
    "retrieved_at": "2026-10-02",
    "source": "MOCK",
    "start_year": 2020,
    "status": "ramp_up"
  },
  {
    "capacity_per_year": 2099.12,
    "capacity_unit": "t_per_year",
    "capex_usd": 545357253.5,
    "company": "Explotaciones del Norte (ilustrativa)",
    "geo": "AR-J",
    "id": "mock-proj-17",
    "name": "Mina del Oeste 5",
    "owners": [
      "Explotaciones del Norte (ilustrativa)",
      "Socio 2 (ilustrativo)"
    ],
    "resource": "copper",
    "retrieved_at": "2026-10-02",
    "source": "MOCK",
    "start_year": 2023,
    "status": "ramp_up"
  },
  {
    "capacity_per_year": null,
    "capacity_unit": null,
    "capex_usd": 211061324.57,
    "company": "Compañía Andina (ilustrativa)",
    "geo": "AR-A",
    "id": "mock-proj-18",
    "name": "Salinas Grandes 4",
    "note": "Capacidad faltante (mock ilustrativo)",
    "owners": [
      "Compañía Andina (ilustrativa)",
      "Socio 3 (ilustrativo)"
    ],
    "resource": "lithium",
    "retrieved_at": "2026-10-02",
    "source": "MOCK",
    "start_year": 2022,
    "status": "exploration"
  },
  {
    "capacity_per_year": 39948.9,
    "capacity_unit": "t_per_year",
    "capex_usd": 237469688.1,
    "company": "Minera Austral (ilustrativa)",
    "geo": "AR-K",
    "id": "mock-proj-19",
    "name": "Cuenca Austral 4",
    "owners": [
      "Minera Austral (ilustrativa)",
      "Socio 4 (ilustrativo)"
    ],
    "resource": "lithium",
    "retrieved_at": "2026-10-02",
    "source": "MOCK",
    "start_year": 2021,
    "status": "construction"
  },
  {
    "capacity_per_year": null,
    "capacity_unit": null,
    "capex_usd": 705946521.64,
    "company": "Energía del Sur (ilustrativa)",
    "geo": "AR-U",
    "id": "mock-proj-20",
    "name": "Bloque Meseta 6",
    "note": "Capacidad faltante (mock ilustrativo)",
    "owners": [
      "Energía del Sur (ilustrativa)",